question,answer,page,category,made_date
私達は今日大英博物館を訪れた。,We visited the British Museum today.,P999,work,2022-02-22
私達は今年はおせちを作りませんでした。,We didn't make osechi this year.,P999,work,2022-02-22
大英博物館は面白いものでいっぱいです。,The British Museum is full of interesting things.,P999,work,2022-02-22
なんてすてきなの！,That's nice!,P999,work,2022-02-22
私達は元日に特別なことをしませんでした。,We did nothing special on new Year's Day.,P999,work,2022-02-22
おなかいっぱい。,I'm full.,P999,work,2022-02-22
それぞれのクラスは４０人生徒がいます。,Each class has 40 students.,P999,work,2022-02-22
それぞれの人が手を持っている。,Each man has hands.,P999,work,2022-02-22
それぞれの車にエンジンがある。,Each car has an engine.,P999,work,2022-02-22
ひまなとき何をしてすごすの？,How do you spend your free time?,P999,work,2022-02-22
明日早めに学校に行く必要があります。,I need to go to school early tomorrow.,P999,work,2022-02-22
早寝早起きがすきです。,I like to get up early and go to bed early.,P999,work,2022-02-22
今日宿題がたくさんあったの。,I had a lot of homework today.,P999,work,2022-02-22
傘持ってこなかったよ。,I didn't bring my umbrella.,P999,work,2022-02-22
あの古い緑の車、かっこいいね。,Tha old green car is cool.,P999,work,2022-02-22
黒板の地図を見てみてよ。,Look at the map on the blackboard.,P999,work,2022-02-22
あの店のそのパンはとてもうまい。,The bread at that shop is very good.,P999,work,2022-02-22
その学校の音楽の授業は楽しい。,The music class at the school is interesting.,P999,work,2022-02-22
髪の短い女の子がまゆみです。,The girl with short hair is Mayumi.,P999,work,2022-02-22
お腹の大きい男の子がいぶきです。,The boy with fatty weast is Ibuki.,P999,papa,2022-02-22
足の臭い男の子がいぶきです。,The boy with smelled legs is Ibuki.,P999,papa,2022-02-22
