question,answer,page,made_date
意見が分かれ話し合いによって決着がつかない場合表決を行い多数の意見を採用する制度を何と呼ぶか,多数決,P511,2021/10/20
国民の代表を選出することを何と呼ぶか,選挙,P511,2021/10/21
1925年に何が制定され制定され満25歳以上の男子は全て選挙権を持ったか,普通選挙法,P511,2021/10/21
一人が一票の投票を行う選挙のことをなんと呼ぶか,平等選挙,P512,2021/10/21
選挙をする際誰に投票したかの秘密が守られる,秘密選挙,P512,2021/10/21
国民が議員など非選挙人を直接に選挙することを何と呼ぶか,直接選挙,P512,2021/10/21
1950年に制定された選挙に関する基本法のことを何と呼ぶか,公職選挙法,P512,2021/10/21
1994年の公職選挙法の改正では何が衆議院議員選挙に導入されたか,小選挙区比例代表並立制,P513,2021/10/21
2000年の公職選挙法の改正では参議院議員選挙の比例代表制が何名簿式から非拘束名簿式に変わったか,拘束名簿式,P513,2021/10/21
2015年の小選挙区比例代表並立制で選挙権の年齢が満20歳以上から満何歳以上に引き下げられたか,満18歳以上,P513,2021/10/21
政治的意見を同じくする人々によって組織され政権を獲得することを目的に政治活動をする団体を何と呼ぶか,政党,P514,2021/10/21
政権を担当する政党のことを何と呼ぶか,与党,P516,2021/10/21
政党を担当しない政党を何と呼ぶか,野党,P516,2021/10/21
政党が議会を通じて政権を握りその政策を実現する政治のことを何と呼ぶか,政党政治,P516,2021/10/21
一つの政党だけでは過半数の議席を得られなかった場合には複数の政党が政策協定を結んで何を組織することがあるか,連立政権（連立内閣）,P516,2021/10/22
意見や要望はいろいろな機会を通じて発表されやがてそれらが人々の多数に支持され国民に共有された意見となった場合にこれを何と呼ぶか,世論,P518,2021/10/23
国会は国民の意思を最もよく代表しているものと考えられる。つまり国会の決定は国民の意思と見なすことができる。そのため国会はナヌであると日本国憲法に定められているか,国権の最高機関,P519,2021/10/23
国会は国内で唯一の何であるか,立法機関,P519,2021/10/23
日本の国会は何と何の二つの議員で構成される二院制（両院制）を採用しているか,衆議院と参議院,P519,2021/10/23
衆議院の定数は何人か,465人,P520,2021/10/23
衆議院の任期は何年で、解散することがあるか,4年,P520,2021/10/23
参議院の定数は何人か,248人,P520,2021/10/23
参議院の任期は何年か,6年,P520,2021/10/23
参議院に解散はあるか,ない,P520,2021/10/23
毎年一月中に召集され次年度の予算審議が課題の中心となる会のことを何と呼ぶか,常会（通常国会）,P521,2021/10/23
内閣が必要と認めたとき又はいずれかの議員の総議員の4分の1以上の要求があった時に召集される国会のことを何と呼ぶか,臨時会（臨時国会）,P521,2021/10/24
衆議院解散後の総選挙の日から30日以内に召集される国会で内閣総理大臣の使命が課題の中心となる国会のことを何と呼ぶか,特別会（特別国会）,P521,2021/10/24
衆議院の解散中に緊急の問題が生じ内閣が必要と認めた時に召集することを何と呼ぶか,参議院の緊急集会,P521,2021/10/24
委員会で特に重要な案件や国民の関心の高い案件について審査している場合その利害関係のある人や専門的な知識を持つ人を招いて意見を聞くことがあるこれを何と呼ぶか,公聴会,P522,2021/10/24
国会の最も大切な仕事は法律を制定することすなわち何であるか,立法,P523,2021/10/24
衆議院と参議院に与えられている国の政治に関して調査することができる権利を何と呼ぶか,国政調査権,P524,2021/10/24
裁判官が不正を行なったり職務を怠ったりした場合その処分を判定する裁判のことを何と呼ぶか,弾劾裁判,P524,2021/10/24
弾劾裁判は両院から7人ずつ選出された何によって裁判が行われるか,弾劾裁判所,P524,2021/10/24
いくつかの重要な決定については衆議院の権限を参議院よりも強くしている。このことを何と呼ぶか,衆議院の優越,P525,2021/10/24
衆議院と参議院の議決が一致しなかった時に意見を調整するために開かれる協議会を何と呼ぶか,両院協議会,P526,2021/10/26
衆議院の解散後何日以内に総選挙が行われるか,総選挙,P526,2021/10/26
総選挙の日から何日以内に特別会が召集されるか,30日以内,P526,2021/10/26
特別会で内閣は何をし、新しい内閣総理大臣が任命されるか,総辞職,P526,2021/10/26
国民生活の安定と向上のために行う各種の施策を何と呼ぶか,行政,P527,2021/10/26
行政を実際に行う権限を何と呼ぶか,行政権,P527,2021/10/26
行政の最高機関のことを何と呼ぶか,内閣,P527,2021/10/26
内閣は何大臣と何大臣によって構成されるか,内閣総理大臣と国務大臣,P527,2021/10/26
内閣総理大臣が主宰する内閣の意思決定会議のことを何と呼ぶか,閣議,P527,2021/10/27
内閣が国会の信任に基づいて成り立ち国会に対して連帯して責任を負う仕組みを何と呼ぶか,議院内閣制,P528,2021/10/27
内閣が憲法や法律の規定を実施するために発する命令のことを何と呼ぶか,政令,P530,2021/10/27
天皇の軍事行為は何によって行われその責任は内閣が負うか,内閣の助言と承認,P530,2021/10/27
公務員の選定・罷免の権利は国民が持っており公務員は一部の人々のためだけではなく何でなければならないか,国民全体の奉仕者,P532,2021/10/27
個人の権利が侵され社会の秩序が乱されるような事件に対し法令を適用して判断（判決）を下す仕事の何と呼ぶか,司法,P534,2021/10/27
民主政治の発展は裁判所が他の機関や政治勢力からも干渉さえず独立して裁判をするという何の原則を生み出したか,司法権の独立,P534,2021/10/27
裁判所は全ての法律や命令、規則、処分などが違法に反していないかどうか審査する権限を持つ。,違憲立法審査権,P535,2021/10/27
最高裁判所は最終的に法令などが合憲か違憲かを決定できる終裁判所であるためなんと言われるか,憲法の番人,P535,2021/10/27
裁判所は何と何の二つに分けることができるか,最高裁判所と下級裁判所,P536,2021/10/27
最高裁判所の裁判官は何によって適確か不適格化を決めているか,国民審査,P536,2021/10/28
裁判を慎重かつ公正におこなうため同じ事件について３回まで裁判を受けることができる。これを何と呼ぶか,三審制,P537,2021/10/28
第一審から第二審に上訴することを何と呼ぶか,控訴,P537,2021/10/28
第二審から第三審に上訴することを何と呼ぶか,上告,P537,2021/10/28
裁判には何裁判と何裁判があるか,刑事裁判と民事裁判,P538,2021/10/28
検察官は犯罪を犯した疑いのあるもの（被疑者）を裁判所に何するか,起訴,P538,2021/10/28
起訴された人のことを何と呼ぶか,被告人,P538,2021/10/28
民事裁判では訴えた人のことを何と呼ぶか,原告,P538,2021/10/28
民事裁判では訴えられた人のことを何と呼ぶか,被告,P538,2021/10/28
警察官が被疑者を逮捕した後起訴、不起訴は誰が行うか,検察官’,P538,2021/10/28
警察官や検察官が住居内の捜索、逮捕などをする場合は裁判官、裁判所の発行する何が必要か,令状,P540,2021/10/29
被疑者は取調べの際に自分に不利な供述をしなくても良い権利の何を持っているか,黙秘権,P540,2021/10/29
無実のものが罪に問われることを何と呼ぶか,冤罪,P541,2021/10/29
第3審の後でも新しい証拠が出るなどして裁判に重大な誤りがあると疑われる場合は判決を取り消し裁判をやり直すことができる。この制度のことを何と呼ぶか,再審制度,P541,2021/10/29
日本では国民に身近で利用しやすい司法の実現を目指して何が進められてきたか,司法制度改革,P541,2021/10/29
2004年には法曹人口の拡大を目的に何が設けられたか。,法科大学院（ロースクール）,P541,2021/10/29
2004年に誰もが身近に法律相談を受けられるように何が設置されたか,日本司法支援センター（法テラス）,P541,2021/10/29
2009年5月からは何制度が始まったか,裁判員制度,P541,2021/10/30
国家権力を、立法・行政・司法に三分しそれぞれ独立の機関に担当させ、三権が相互に抑制しあって均衡を保つことを何と呼ぶか。,三権分立,P543,2021/10/30
アメリカ合衆国のように行政に属する大統領が議会（立法）に議席を持つことを許されず厳格に三権分立が行われている国のことを何と呼ぶか,大統領制,P543,2021/10/30
イギリスのように行政（内閣）を立法（議会）の信任のもとに置く国のことを何と呼ぶか,議院内閣制,P543,2021/10/30
地方自治は何と言われるか,民主主義の学校,P545,2021/10/30
1947年には何法が日本国憲法と同時に施行されたか,地方自治法,P545,2021/10/30
1999年に地方分権一括法が制定された。制定以降は国の仕事の多くが地方公共団体に任されることになり現在でも何は進んでいるか,地方分権,P546,2021/10/30
地方議会での議決を施行するのが首長、すなわち何であるか,都道府県知事、市（区）町村長,P547,2021/10/30
都道府県知事の被選挙権は満何歳以上か,30歳以上,P547,2021/10/31
市（区）町村長の被選挙権は満何歳以上か,25歳以上,P547,2021/10/31
地方公共団体間の地方勢収入の格差を減らすために国から地方公共団体に配分されるお金のことを何と呼ぶか,地方交付税交付金,P549,2021/10/31
国が使い道を指定して地方公共団体に支出する賃金のことを何と呼ぶか,国庫支出金,P549,2021/10/31
有権者総数の何分の何以上の署名があった場合条例の制定や改廃を請求することができるか,50分の1,P550,2021/10/31
議員と首長の解職請求は有権者の何分の何以上の署名を集めると選挙管理委員会へ請求することができるか,3分の1,P550,2021/10/31
解職請求のことを何と呼ぶこともあるか,リコール,P550,2021/10/31
一定の地域にだけ適用される特別法にはその地方公共団体の何で過半数の同意を得ることが必要であるか,住民投票（レファレンダム）,P551,2021/10/31
地方公共団体の行政に対する苦情を受け付け中立的な立場から調査するオンブズマンをおいて市政を監視する制度のことを何と呼ぶか,オンブズマン（オンブスパーソン）制度,P551,2021/11/01
税やサービスという商品の生産・流通・消費などにかかわる人々の営みやそれを支える社会の仕組みのことを何と呼ぶか,経済,P558,2021/11/01
家庭の収入と支出を通して家庭を維持することを何と呼ぶか,家計,P558,2021/11/01
経済の主体は家計だけではなく何と政府があるか,企業,P558,2021/11/01
経済の主体は家計だけではなく何と企業があるか,政府,P558,2021/11/01
収入は生産活動を行うことで得る報酬から経済を差し引いた残りを何と呼ぶか,所得,P558,2021/11/01
消費生活を行うために必要な財・サービスを買うために支払う費用のことを何と呼ぶか,消費支出,P558,2021/11/01
実支出以外の支出の代表的なものに何があるか,貯蓄,P558,2021/11/01
